<!ELEMENT products (product+)>
<!ELEMENT product (name, price, description)>
<!ELEMENT name (#PCDATA)>
<!ELEMENT price (#PCDATA)>
<!ELEMENT description (#PCDATA)>
<!ATTLIST product stock CDATA #REQUIRED>
<!ATTLIST product category (ELECTRONICS | COSMETICS) "ELECTRONICS">